{
  "id": "MD-001",
  "version": "2.0.0",
  "status": "eingefroren",
  "stand": "2026-08-08",
  "messfrage": "In wie vielen der vom Bundesgericht endgueltig entschiedenen Streitigkeiten, in denen sich eine Mietpartei gegen eine Kuendigung auf den Kuendigungsschutz nach Art. 271/271a OR berief, wurde dieser Kuendigungsschutz durchgesetzt — also die Kuendigung als missbraeuchlich aufgehoben? Eine Erstreckung des Mietverhaeltnisses nach Art. 272 OR zaehlt hier NICHT als Erfolg; sie ist eine andere Rechtsfolge und gehoert in eine eigene Messdefinition.",
  "norm": {
    "norm_fundstelle": "Art. 271 und Art. 271a OR (SR 220)",
    "pruefstand": "fachlich_bestaetigt"
  },
  "quelle": {
    "name": "entscheidsuche.ch",
    "endpunkt": "https://entscheidsuche.ch/_search.php",
    "abrufart": "metadaten"
  },
  "abfrage": {
    "suchanfrage": "(\"271a\" OR \"Art. 271\" OR \"art. 271\" OR \"missbräuchliche Kündigung\" OR \"congé abusif\" OR \"annulation du congé\" OR \"disdetta abusiva\" OR \"annullamento della disdetta\") AND (Mietverhältnis OR Mietvertrag OR Mietzins OR \"bail à loyer\" OR locataire OR \"contratto di locazione\" OR conduttore)",
    "gerichtsfilter": ["CH_BGer", "CH_BGE"]
  },
  "zeitraum": {
    "von": "2015-01-01",
    "bis": "2025-12-31"
  },
  "einschluss": [
    {
      "code": "kuendigungsschutz_streitig",
      "beschreibung": "Der Entscheid beurteilt materiell, ob eine Kuendigung des Mietverhaeltnisses dem Kuendigungsschutz nach Art. 271/271a OR standhaelt.",
      "bezug": "verfahrensgegenstand"
    },
    {
      "code": "mietpartei_beruft_sich",
      "beschreibung": "Die Mietpartei hat sich im Verfahren auf diesen Kuendigungsschutz berufen.",
      "bezug": "verfahrensgegenstand"
    }
  ],
  "ausschluss": [
    {
      "code": "andere_rechtsfrage",
      "beschreibung": "Der Entscheid betrifft eine andere Bestimmung; der Kuendigungsschutz ist nicht Streitgegenstand.",
      "bezug": "verfahrensgegenstand"
    },
    {
      "code": "nur_erstreckung",
      "beschreibung": "Streitig ist allein die Erstreckung des Mietverhaeltnisses nach Art. 272 OR, nicht die Zulaessigkeit der Kuendigung selbst.",
      "bezug": "verfahrensgegenstand"
    },
    {
      "code": "kein_mietverhaeltnis",
      "beschreibung": "Dem Verfahren liegt kein Mietverhaeltnis nach Art. 253 ff. OR zugrunde (etwa Pacht oder Gebrauchsleihe).",
      "bezug": "verfahrensgegenstand"
    },
    {
      "code": "nur_prozessuale_nebenfrage",
      "beschreibung": "Der Entscheid behandelt allein eine Nebenfrage neben der Hauptsache, etwa Kosten oder aufschiebende Wirkung.",
      "bezug": "formal"
    },
    {
      "code": "text_nicht_zugaenglich",
      "beschreibung": "Der bei der Quelle verzeichnete Entscheidtext ist nicht abrufbar; die Zuordnung ist datenseitig unmoeglich.",
      "bezug": "datenlage"
    }
  ],
  "rechtskraft_regel": {
    "art": "bundesgericht_art61_bgg",
    "rechtsquelle": "Art. 61 BGG (SR 173.110)",
    "begruendung": "Entscheide des Schweizerischen Bundesgerichts erwachsen am Tag ihrer Ausfaellung in Rechtskraft (Art. 61 BGG); ein ordentliches Rechtsmittel dagegen besteht nicht. Die Revision nach Art. 121 ff. BGG aendert daran nichts — sie ist gerade der aussergewoehnliche Weg, auf einen bereits rechtskraeftigen eigenen Entscheid zurueckzukommen. WICHTIG: Diese Ableitung gilt ausschliesslich fuer Entscheide des Schweizerischen Bundesgerichts. Sie ist KEINE generische Regel fuer kantonale letztinstanzliche Entscheide — gegen diese steht die Beschwerde ans Bundesgericht offen, ihre Rechtskraft folgt nicht aus der Instanz.",
    "pruefstand": "fachlich_bestaetigt"
  },
  "abschluss_regel": {
    "art": "endentscheid_zur_messfrage",
    "begruendung": "Rechtskraft und Fallabschluss sind zwei verschiedene Dinge. Ein Bundesgerichtsentscheid ist ab Ausfaellung rechtskraeftig und kann die Sache trotzdem zur neuen materiellen Beurteilung zurueckweisen; dann ist offen, ob der Kuendigungsschutz am Ende durchdrang. Massgeblich ist die Unterscheidung Endentscheid / Vor- und Zwischenentscheid: ein Endentscheid schliesst das Verfahren in der Hauptsache ab, ein Entscheid, der das Verfahren nicht abschliesst, tut es nicht. Zaehlfaehig ist eine Streitigkeit deshalb erst, wenn zur Messfrage keine neue materielle Entscheidung mehr noetig ist: entweder entscheidet das Bundesgericht sie selbst, oder ein verknuepfter abschliessender Folgeentscheid liegt vor. Eine Rueckweisung mit offenem materiellem Entscheidungsbedarf ist nicht abgeschlossen; reine Zwischen- und Nebenentscheide zaehlen nie.",
    "pruefstand": "fachlich_bestaetigt"
  },
  "zaehleinheit": {
    "art": "streitigkeit",
    "beschreibung": "Eine zugrunde liegende Kuendigungsstreitigkeit zwischen denselben Parteien um dieselbe Kuendigung ist EINE Zaehleinheit. Rueckweisung, Folgeentscheid und Revision derselben Streitigkeit werden verknuepft und zaehlen zusammen einmal; alle Treffer bleiben im Rohkorpus erhalten."
  },
  "selektionsneutralitaet": "Alle Kriterien stuetzen sich auf den Streitgegenstand, eine formale Eigenschaft oder die Datenlage. Keines nennt oder kennt den Verfahrensausgang, keines uebernimmt ein Merkmal des Redaktionstrichters (redaktion/sieb.json, der Nichteintretensentscheide und Kostenentscheide abwertet und den Nenner damit nach oben verzerren wuerde), und keines sortiert nach Sprache: die Abfrage erfasst Deutsch, Franzoesisch und Italienisch, damit der Nenner nicht ein Sprachgebiet abbildet und sich schweizerisch nennt. Falschpositive Treffer sind zulaessig — sie fallen ueber die inhaltlichen Kriterien wieder heraus; falschnegative fehlen im Nenner und faellt niemandem auf. Zeitraum und Abfrage stehen wortgleich in dieser Datei und sind durch den Definitions-Hash gebunden."
}
